{"skill":{"id":"al-finance-review","version":1},"outcome":"not-applicable","outcome-reason":"The changed code only performs an HTTP heartbeat request and does not involve general-journal posting, Finance-owned ledger records, VAT, applications, reversals, or posting-linked dimensions.","summary":{"counts":{"blocker":0,"major":0,"minor":0,"info":0},"coverage":{"worklist-size":0,"items-evaluated":0}},"findings":[],"suppressed":[],"sub-results":[],"skipped-sub-skills":[]}
